{
  "schema": "coach-result.v1",
  "analysisId": "0b0c4f1e-5a8d-4c47-9b1e-6c1f2a3b4c5d",
  "sport": "badminton",
  "skill": "bd.clear_fh",
  "narrativeLanguage": "vi",
  "createdAt": "2026-10-20T08:15:42Z",
  "status": "succeeded",
  "rejection": null,
  "access": "free",
  "locked": {
    "strengths": 1,
    "weaknesses": 2,
    "plan": 3
  },
  "aiGenerated": true,
  "hero": {
    "checkpointId": "bd.clear_fh.C3",
    "faultId": "bd.clear_fh.low_elbow",
    "title": "Khuỷu tay thấp khi kéo vợt",
    "observation": "Ở cuối pha kéo vợt, khuỷu tay của bạn còn thấp hơn vai nên cú đánh giống đẩy cầu hơn là ném cầu.",
    "cue": {
      "vi": "Khuỷu tay ngang vai, như ném bóng",
      "en": "Elbow at shoulder height, like a throw"
    },
    "drill": {
      "id": "bd.drill.towel_snap",
      "title": {
        "vi": "Vung khăn",
        "en": "Towel snap"
      },
      "steps": {
        "vi": [
          "Cầm một đầu khăn như cầm vợt.",
          "Nâng khuỷu tay ngang vai, khăn ra sau lưng.",
          "Vung mạnh lên trên và ra trước để khăn kêu tách."
        ],
        "en": [
          "Hold one end of a towel like a racket.",
          "Lift the elbow to shoulder height, towel behind your back.",
          "Swing up and forward so the towel snaps."
        ]
      },
      "dose": {
        "sets": 3,
        "reps": 10,
        "seconds": null
      },
      "safety": null
    },
    "frameId": "F2",
    "joints": [
      "rSho",
      "rElb",
      "rWri"
    ]
  },
  "overall": {
    "displayScore": 55,
    "level": "improving",
    "coverage": 0.82,
    "partial": false,
    "beta": true
  },
  "subScores": [
    {
      "key": "stance",
      "displayScore": 70,
      "coverage": 0.9,
      "confidence": "high",
      "name": {
        "vi": "Tư thế & Thăng bằng",
        "en": "Stance & Balance"
      }
    },
    {
      "key": "footwork",
      "displayScore": 60,
      "coverage": 0.55,
      "confidence": "medium",
      "name": {
        "vi": "Di chuyển (bộ pháp)",
        "en": "Footwork"
      }
    },
    {
      "key": "swing",
      "displayScore": 45,
      "coverage": 0.85,
      "confidence": "high",
      "name": {
        "vi": "Kỹ thuật vung vợt",
        "en": "Swing mechanics"
      }
    },
    {
      "key": "contact",
      "displayScore": 60,
      "coverage": 0.8,
      "confidence": "medium",
      "name": {
        "vi": "Điểm chạm cầu",
        "en": "Contact point"
      }
    },
    {
      "key": "follow",
      "displayScore": 65,
      "coverage": 0.6,
      "confidence": "medium",
      "name": {
        "vi": "Kết thúc động tác",
        "en": "Follow-through"
      }
    },
    {
      "key": "recovery",
      "displayScore": null,
      "coverage": 0.3,
      "confidence": "low",
      "name": {
        "vi": "Về vị trí (hồi vị)",
        "en": "Recovery"
      }
    }
  ],
  "strengths": [
    {
      "checkpointId": "bd.clear_fh.C5",
      "title": "Chạm cầu ở điểm cao",
      "detail": "Bạn vươn tay lên cao khi chạm cầu ở cả ba cú đánh, đây là nền tảng tốt cho phông cầu sâu.",
      "evidence": [
        {
          "strokeId": 2,
          "tUs": 7883333,
          "frameId": "F3",
          "metricKey": "bd.clear_fh.C5",
          "observation": "Tay vợt gần như duỗi thẳng lên trên khi chạm cầu.",
          "plain": {
            "vi": "chạm cầu ở điểm cao",
            "en": "contact at a high point"
          },
          "detail": {
            "valueText": "0,93",
            "targetText": "≥ 0,85"
          },
          "joints": [
            "rSho",
            "rWri"
          ]
        }
      ]
    }
  ],
  "weaknesses": [],
  "plan": [],
  "strokes": [
    {
      "id": 1,
      "tStartUs": 3420000,
      "tContactUs": 3910583,
      "contactIsEstimate": true,
      "tEndUs": 4300000,
      "phases": {
        "ready": 2900000,
        "bsEnd": 3760000,
        "contact": 3910583,
        "ftStop": 4116667
      },
      "role": null
    },
    {
      "id": 2,
      "tStartUs": 7400000,
      "tContactUs": 7883333,
      "contactIsEstimate": true,
      "tEndUs": 8283333,
      "phases": {
        "ready": 6883333,
        "bsEnd": 7733333,
        "contact": 7883333,
        "ftStop": 8100000
      },
      "role": "best"
    },
    {
      "id": 3,
      "tStartUs": 11350000,
      "tContactUs": 11816667,
      "contactIsEstimate": true,
      "tEndUs": 12233333,
      "phases": {
        "ready": 10833333,
        "bsEnd": 11666667,
        "contact": 11816667,
        "ftStop": 12050000
      },
      "role": "worst"
    }
  ],
  "safety": [
    {
      "kind": "warmup",
      "message": "Khởi động vai và cổ tay vài phút trước khi tập các bài vung vợt.",
      "localized": null,
      "checkpointId": null
    }
  ],
  "notAssessable": [
    {
      "aspect": "Cách cầm vợt",
      "howToCapture": "Cách cầm vợt khó thấy từ xa; hãy hỏi HLV kiểm tra trực tiếp."
    },
    {
      "aspect": "Độ sâu của cầu",
      "howToCapture": "Ứng dụng chưa theo dõi được quả cầu; hãy tự quan sát cầu có rơi sát vạch cuối không."
    }
  ],
  "recordingTips": [
    "Đặt máy ở góc chéo phía sau, cao ngang đầu, để thấy rõ vai và khuỷu tay.",
    "Quay 5–10 cú phông cầu liên tiếp, đủ cả người và vợt trong khung hình."
  ],
  "rulesTip": {
    "vi": "Cầu chạm vạch là cầu trong. Phông cầu tốt rơi sát vạch cuối sân.",
    "en": "A shuttle landing on the line is in. A good clear lands near the back line."
  },
  "summary": "Bạn đã chạm cầu ở điểm cao và giữ vợt sẵn sàng rất tốt. Điều cần sửa trước là nâng khuỷu tay ngang vai khi kéo vợt, để cú phông cầu có lực và đi sâu hơn.",
  "meta": {
    "model": "claude-sonnet-5-5",
    "kind": "standard",
    "promptVersion": "base-system-v2.0",
    "rubricVersion": "f3b4ee9650a9d2d7ff02fbc4fe11f26b98502a66c1231532fac290ba0b9892fe",
    "algoVersion": "engine-1.1.0",
    "schemaVersion": "coach.v1"
  }
}
